{
  "scenario_id": "DD-01-json-repair",
  "protocol_version": "0.1",
  "status": "draft",
  "task": "Repair malformed JSON while preserving its semantic data.",
  "budget_usdc": "0.02",
  "policy_id": "balanced-v0.1",
  "task_requirements": {
    "deterministic_correctness_required": true
  },
  "snapshot_at": "2026-09-12T11:47:42.013862Z",
  "candidates": [
    {
      "candidate_id": "keyronne-json-repair",
      "provider": "Keyronne",
      "service_name": "JSON Repair",
      "endpoint": "https://keyronne.com/api/json-repair",
      "method": "POST",
      "price_usdc": "0.001",
      "network": "eip155:8453",
      "machine_contract": {
        "request": {"text": "malformed JSON text"},
        "description": "Repair malformed JSON and return a parsed value plus repair information.",
        "directory_query": "json repair",
        "directory_rank_before_objective_filters": 1
      },
      "discovery_source": "https://x402.new/services?q=json+repair",
      "contract_hash": null
    },
    {
      "candidate_id": "agentproof-json-repair",
      "provider": "AgentProof",
      "service_name": "JSON Repair",
      "endpoint": "https://agentproof-murex.vercel.app/json/repair",
      "method": "POST",
      "price_usdc": "0.001",
      "network": "eip155:8453",
      "machine_contract": {
        "request": {"input": "malformed JSON text"},
        "description": "Repair malformed JSON and return parsed/repaired output.",
        "directory_query": "json repair",
        "directory_rank_before_objective_filters": 3
      },
      "discovery_source": "https://x402.new/services?q=json+repair",
      "contract_hash": null
    },
    {
      "candidate_id": "hermes-json-schema-repair",
      "provider": "Hermes Commerce",
      "service_name": "JSON Schema Repair (Deterministic)",
      "endpoint": "https://agent.kihustle.tech/services/json-schema-repair/jobs",
      "method": "POST",
      "price_usdc": "0.010",
      "network": "eip155:8453",
      "machine_contract": {
        "request": {"json_text": "malformed JSON text", "schema": {"type": "object"}},
        "description": "Deterministic JSON repair with schema checking.",
        "directory_query": "json repair",
        "directory_rank_before_objective_filters": 4
      },
      "discovery_source": "https://x402.new/services?q=json+repair",
      "contract_hash": null
    },
    {
      "candidate_id": "api-acre-json-repair",
      "provider": "API Acre",
      "service_name": "JSON Repair",
      "endpoint": "https://apiacre.com/v1/data/json-repair",
      "method": "POST",
      "price_usdc": "0.005",
      "network": "eip155:8453",
      "machine_contract": {
        "request": {
          "content": "malformed JSON text",
          "repairs": ["single_quoted_strings", "unquoted_keys", "trailing_commas"]
        },
        "description": "Repair malformed JSON using selected repair strategies.",
        "directory_query": "json repair",
        "directory_rank_before_objective_filters": 6
      },
      "discovery_source": "https://x402.new/services?q=json+repair",
      "contract_hash": null
    }
  ],
  "evidence_snapshot": {
    "keyronne-json-repair": {
      "known": true,
      "evidence_summary": {
        "paid_tests": 1,
        "successful_fulfilments": 1,
        "failed_fulfilments": 0,
        "successful_assertion_evaluations": 1,
        "failed_assertion_evaluations": 0,
        "last_verified": "2026-08-28T10:52:50.381298Z"
      },
      "evidence_references": ["docs/evidence/2026-08-28-proof3-01-keyronne.json"]
    },
    "agentproof-json-repair": {
      "known": false,
      "reason": "Historical AgentProof observation used a different exact endpoint and is not attached to the current route."
    },
    "hermes-json-schema-repair": {
      "known": true,
      "evidence_summary": {
        "paid_tests": 1,
        "successful_fulfilments": 1,
        "failed_fulfilments": 0,
        "successful_assertion_evaluations": 0,
        "failed_assertion_evaluations": 1,
        "last_verified": "2026-08-28T10:52:55.571640Z"
      },
      "evidence_references": ["docs/evidence/2026-08-28-proof3-04-hermes-commerce-kihustle-tech.json"]
    },
    "api-acre-json-repair": {
      "known": true,
      "evidence_summary": {
        "paid_tests": 1,
        "successful_fulfilments": 1,
        "failed_fulfilments": 0,
        "successful_assertion_evaluations": 1,
        "failed_assertion_evaluations": 0,
        "last_verified": "2026-08-28T10:52:57.261003Z"
      },
      "evidence_references": ["docs/evidence/2026-08-28-proof3-05-api-acre.json"]
    }
  },
  "notes": [
    "Atinamos-owned JSON Repair was excluded by the external-service rule, not by evidence outcome.",
    "The Railway JSON-repair candidate was excluded by the Base-mainnet rule because its live challenge advertised eip155:84532 (Base Sepolia).",
    "Expected outcome is deliberately not frozen. A no-delta result is valid."
  ]
}
